direction,name,ingredients,url,products,crawl_time,prep_time,servings,img_url,description
"1  Heat oven to 350 degrees F. Coat two 9-inch-round baking pans with cooking spray.,2  Combine sugar, ginger and salt in food processor. Whirl until ginger is finely chopped, 10 seconds. Add flour. Whirl until combined. Add butter. Pulse until butter is finely chopped. Whirl until mixture comes together.,3  Crumble mixture into prepared pans, dividing evenly. Press evenly over bottoms using glass with flat bottom or aluminum measuring cup to compact and level. Sprinkle nuts over dough in pans; lightly pat nuts into dough.,4  Bake in 350 degrees F oven 20 to 25 minutes, until golden. Cool in pans on racks 10 minutes. While still warm, cut each round into 12 wedges. Cool completely on rack. Store wedges in airtight container at room temperature for up to 2 weeks.",Ginger Pignoli Shortbread,"3/4,1/3,1/2,2 1/4,1,6,cup,cup,teaspoon,cups,cup,tablespoons,confectioners sugar,crystallized ginger,salt,all-purpose flour,(2 sticks) chilled unsalted butter, cut into pats,pine nuts (pignoli)",http://www.familycircle.com/recipe/bars/ginger-pignoli-shortbread/,"confectioners sugar,crystallized ginger,salt,all-purpose flour,(2 sticks) chilled unsalted butter cut into pats,pine nuts (pignoli)",2017-03-23 16:09:45,10 mins,24 cookies,http://images.familycircle.mdpcdn.com/sites/familycircle.com/themes/meredith/images/recipe-default.png,  
"1  In large saucepan, cover potatoes with cold water. Bring to boiling over high heat; cook until tender, about 20 minutes. Drain.,2  Meanwhile, in large bowl, stir together sour cream, mayonnaise, dill, parsley, salt and pepper.,3  Cut potatoes while still warm into bite-size pieces, leaving skins on potatoes. Add to sour cream mixture; toss to coat. Cover and refrigerate overnight. Garnish with additional chopped parsley, if desired.",Dill and Sour Cream Potato Salad,"3,1,2/3,1,2,1,1/4,pounds,cup,cup,tablespoon,teaspoons,teaspoon,teaspoon,small red-skin potatoes, with skins,sour cream,mayonnaise,chopped fresh dill OR: 1 teaspoon dried dill,chopped fresh parsley plus extra for garnish,salt,freshly ground black pepper",http://www.familycircle.com/recipe/salads/dill-and-sour-cream-potato-salad/,"small red-skin potatoes with skins,sour cream,mayonnaise,chopped fresh dill OR: 1 teaspoon dried dill,chopped fresh parsley plus extra for garnish,salt,freshly ground black pepper",2017-03-23 16:09:49,10 mins,8 servings,http://images.familycircle.mdpcdn.com/sites/familycircle.com/themes/meredith/images/recipe-default.png,  
"1  Cut fourteen 5 x 5-inch squares of aluminum foil. Press over the outside of 14 inverted 10-ounce metal or glass baking dishes, covering bottom and going up sides about 1/2 inch. (You may also use 4-1/2 x 1-1/4-inch disposable foil pans as is or covered with foil squares.),2  Melt chocolate and shortening in top of double boiler over hot, not boiling water, until smooth. (Or place in glass bowl and heat in microwave oven until melted.) Stir in nuts. Let mixture cool slightly, but remains spreadable, about 15 minutes.,3  Using a small metal spatula, carefully spread 2 tablespoons chocolate mixture over bottom and about 1/4 inch down sides of each foil-covered dish. Refrigerate 30 minutes or until firm.,4  Combine sugar, cornstarch, ginger and salt in medium-size saucepan. Gradually add milk, blending until smooth. Cook over medium heat, stirring constantly, until mixture thickens and comes to a boil; cook, stirring continuously, for 1 minute. Pour into small bowl. Place piece of plastic wrap directly onto surface. Refrigerate several hours or until the filling is completely chilled.,5  Carefully peel aluminum foil away from chocolate shells. Place shells on serving platter and refrigerate.,6  Working with 1 shell at a time, spoon level 2 tablespoons chilled Ginger Filling into each shell; spread until smooth. Return to refrigerator to cool. Repeat, using all shells and filling.,7  Arrange quartered strawberries on top of each tart. Sprinkle with candied ginger.,8  Melt chocolate chips in top of double boiler over hot, not boiling water, until smooth. Remove from heat and cool slightly. Pour into small heavy-duty food-storage bag. Snip very small tip off one corner of bag. Pipe chocolate over tarts in decorative pattern.",Chocolate and Ginger Tarts,"1,2,2,1/4,3,1,1/4,2,1,2,3/4,,12,tablespoons,cups,,cup,tablespoons,teaspoon,teaspoon,cups,,cup,tablespoons,cup,Chocolate Tart Shells:,semisweet chocolate chips,solid vegetable shortening,finely chopped nuts, such as walnuts,Ginger Filling:,sugar,cornstarch,grated fresh ginger,salt,milk,Topping:,strawberries, hulled and quartered,finely chopped candied ginger,semisweet chocolate chips",http://www.familycircle.com/recipe/tarts/chocolate-and-ginger-tarts/,"Chocolate Tart Shells:,semisweet chocolate chips,solid vegetable shortening,finely chopped nuts such as walnuts,Ginger Filling:,sugar,cornstarch,grated fresh ginger,salt,milk,Topping:,strawberries hulled and quartered,finely chopped candied ginger,semisweet chocolate chips",2017-03-23 16:09:57,30 mins,14 servings,http://images.familycircle.mdpcdn.com/sites/familycircle.com/themes/meredith/images/recipe-default.png,
"1  Combine the 1/2 teaspoon sugar and warm water in small cup. Sprinkle yeast over top; let stand until foamy, for about 10 minutes.,2  Heat butter, remaining 1/3 cup sugar and the salt in small saucepan over low heat until butter is melted. Pour into large bowl and cool to lukewarm. Beat in eggs and extract until well blended.,3  Stir together the cake flour, potato flakes, ground cinnamon and nutmeg in a medium-size bowl.,4  Stir yeast mixture into the butter mixture. On low speed, beat in flour until soft dough forms. Stir in raisins.,5  Turn dough out onto lightly floured surface. Knead until smooth and elastic, about 5 minutes. Place dough in lightly greased bowl, turning to coat. Cover with waxed paper; let rise in warm place until doubled in volume, about 1 hour.,6  Punch down; knead a few times. Let rest about 5 minutes.,7  Divide dough into 8 equal pieces; shape into balls. Place balls on greased baking sheet. Cover and let rise until doubled in volume, 30 to 45 minutes.,8  When ready to bake, heat oven to 325 degrees F. Bake buns in 325 degrees F oven for 18 to 20 minutes. Remove to wire rack to cool completely.,9  Mix the confectioners sugar, hot water, salt, vanilla and lemon extract in small bowl until smooth. When buns are completely cool, top with the glaze.",Cinnamon Buns,"1/2,3/4,1,2,3/4,2,1/2,3 1/2,1,2,1/2,1/3,1,teaspoon,cup,,tablespoons,teaspoon,,teaspoon,cups,tablespoon,teaspoons,teaspoon,cup,,plus 1/3 cup sugar,warm water (105 degrees F to 115 degrees F),envelope active dry yeast,butter,salt,eggs,lemon extract,cake flour (not self-rising),potato flakes,ground cinnamon,ground nutmeg,dark raisins,recipe Glaze",http://www.familycircle.com/recipe/sweet-rolls/cinnamon-buns/,"plus 1/3 cup sugar,warm water (105 degrees F to 115 degrees F),envelope active dry yeast,butter,salt,eggs,lemon extract,cake flour (not self-rising),potato flakes,ground cinnamon,ground nutmeg,dark raisins,recipe Glaze",2017-03-23 16:10:04,20 mins,8 buns,http://images.familycircle.mdpcdn.com/sites/familycircle.com/themes/meredith/images/recipe-default.png,
"1  Heat oven to 425 degrees F. Line a large baking sheet with nonstick foil.,2  Place mini pitas on baking sheet; bake at 425 degrees F for 5 minutes.,3  Spoon about 1-1/2 teaspoons marinara sauce over each pita. Sprinkle 1 teaspoon of mozzarella cheese over each and top with a piece of rolled prosciutto and 1 teaspoon of goat cheese.,4  Bake at 425 degrees F for an additional 8 to 10 minutes or until mozzarella has melted and goat cheese has softened.,5  Remove from the oven and serve immediately.",Goat Cheese Mini Pizzas,"2,3/4,1/2,1,2,7,cup,cup,3,ounces,mini pita breads, 12 in a package,marinara sauce,shredded mozzarella cheese,thinly sliced prosciutto, cut into 24 equal pieces and rolled,basil-flavored goat cheese, from a 5.3-ounce package",http://www.familycircle.com/recipe/appetizers-snacks/goat-cheese-mini-pizzas/,"mini pita breads 12 in a package,marinara sauce,shredded mozzarella cheese,thinly sliced prosciutto cut into 24 equal pieces and rolled,basil-flavored goat cheese from a 5.3-ounce package",2017-03-23 16:10:08,15 mins,24 servings,http://images.familycircle.mdpcdn.com/sites/familycircle.com/themes/meredith/images/recipe-default.png,  
"1  Heat oven to 350 degrees F. Line 2 baking sheets with foil.,2  Mix paprika, salt, black pepper and ground red pepper in small bowl.,3  Brush both sides of ribs with oil. Sprinkle both sides with spice mixture. Set one rack of ribs, rib side up, on each prepared baking sheet.,4  Roast in 350 degrees F oven 1 hour. Turn ribs over; roast another 45 minutes.,5  Process chutney, vinegar and sugar in food processor until pureed.,6  Brush both sides of ribs with half of the chutney mixture. Continue roasting for another 15 minutes. Remove ribs on sheets from oven and let cool. (Recipe may be prepared ahead up to this point and refrigerated; see Note.),7  Cut racks into individual ribs. Brush with the remaining chutney mixture; sprinkle with sesame seeds.,8  Return to 350 degrees F oven 15 minutes or until sesame seeds have browned.,9  To reheat, proceed with step 7. Then roast ribs in 350 degrees F oven for 30 minutes.",Sweet and Sour Ribs With Sesame Seeds,"2,1,1,1 1/2,4 1/2,3,1,6,1/4,2,tablespoons,tablespoon,tablespoon,teaspoons,pounds,tablespoons,10,tablespoons,cup,tablespoons,paprika,salt,black pepper,ground red pepper (cayenne),(2 racks) spare ribs,vegetable oil,mango chutney,balsamic vinegar,packed light-brown sugar,sesame seeds",http://www.familycircle.com/recipe/pork/sweet-and-sour-ribs-with-sesame-seeds/,"paprika,salt,black pepper,ground red pepper (cayenne),(2 racks) spare ribs,vegetable oil,mango chutney,balsamic vinegar,packed light-brown sugar,sesame seeds",2017-03-23 16:10:17,5 mins,8 servings,http://images.familycircle.mdpcdn.com/sites/familycircle.com/themes/meredith/images/recipe-default.png,  
"1  Simmer cranberries, juice, rind and 3 tablespoons sugar in saucepan 12 minutes, until consistency of cranberry sauce. Let cool.,2  Heat oven to 425 degrees F.,3  On floured surface, roll half of pastry into 13-inch circle; pinch together any cracks around edges. Roll crust onto rolling pin; transfer to 9-inch pie plate. Smooth pastry over bottom and up sides of plate. Trim crust so it covers lip of plate.,4  Peel apples. Core; cut each apple into 8 slices, about 1/2 inch thick. Combine apple slices, remaining 1/4 cup granulated sugar, brown sugar, cornstarch, cinnamon and cloves in large bowl. Add cooled cranberry mixture and egg yolk; stir well to mix. Scrape into pie plate; spread apples, mounding high in center; do not compact them.,5  On floured surface, roll out remaining half of pastry to 13-inch circle. Drape over pie. Trim dough, leaving 3/4-inch overhang. Fold top crust under bottom crust; press to seal. Flute edge. Cut 10 vents in top. Brush crust with milk; sprinkle with sugar. Place on baking sheet.,6  Bake in 425 degrees F oven 15 minutes. Reduce to 400 degrees F. Bake 40 to 45 minutes, until golden brown. Remove to rack; cool at least 40 minutes.,7  Whisk together flour, salt and cinnamon in medium-size bowl.,8  Using medium-size bowl and pastry blender or 2 knives, or in food processor with pulsing action, cut shortening into flour mixture until consistency of small peas. Cut in butter. Add water, a little at a time, tossing with a fork, until dough is moistened and holds together when pinched.,9  Turn dough out onto a sheet of plastic wrap; gently press into a ball. Cut ball in half; flatten each half into a disk. Wrap each disk with plastic wrap. Refrigerate for at least 30 minutes.",Cran-Apple Pie,"1,1/2,1/2,3,1,8,1/2,3,1,1,1,cup,cup,teaspoon,tablespoons,,,cup,tablespoons,,,,tablespoon,tablespoon,fresh or frozen cranberries, chopped,apple juice,grated orange rind,plus 1/4 cup granulated sugar,recipe Double-Crust Pastry, prepared with cinnamon (recipe follows),McIntosh apples (about 2-1/2 pounds),packed light-brown sugar,cornstarch,Pinch ground cinnamon,Pinch ground cloves,egg yolk,milk,granulated sugar, for sprinkling",http://www.familycircle.com/recipe/pies/cran-apple-pie/,"fresh or frozen cranberries chopped,apple juice,grated orange rind,plus 1/4 cup granulated sugar,recipe Double-Crust Pastry prepared with cinnamon (recipe follows),McIntosh apples (about 2-1/2 pounds),packed light-brown sugar,cornstarch,Pinch ground cinnamon,Pinch ground cloves,egg yolk,milk,granulated sugar for sprinkling",2017-03-23 16:10:22,1 hr,12 servings,http://images.familycircle.mdpcdn.com/sites/familycircle.com/themes/meredith/images/recipe-default.png,  
"1  Whisk soy, oil, juice and ginger in bowl. Pour over tuna in baking dish. Refrigerate 15 minutes, turning once. Mix mayonnaise, ginger, soy in bowl. Refrigerate.,2  Prepare grill with medium-hot coals; coat rack with cooking spray. Or coat stove-top grill pan; heat over high heat until pan starts to smoke slightly, about 3 minutes.,3  Remove tuna from marinade; pat dry with paper toweling. Cook on grill or pan, 3 minutes a side for medium. Transfer to platter; tent with foil.,4  Spread bread with mayonnaise; make 4 sandwiches with lettuce, avocado and tuna.",Grilled Tuna on Sourdough,"2,1,1,1,4,2,1,1,8,4,1,tablespoons,tablespoon,tablespoon,tablespoon,,,tablespoons,teaspoon,teaspoon,slices,,,soy sauce,dark sesame oil,fresh lemon juice,chopped fresh ginger,tuna steaks (each about 4 ounces),Ginger Mayonnaise:,mayonnaise,chopped fresh ginger,soy sauce,sourdough bread,leaves red-leaf lettuce,California avocado, peeled, pitted, lightly mashed",http://www.familycircle.com/recipe/seafood/grilled-tuna-on-sourdough/,"soy sauce,dark sesame oil,fresh lemon juice,chopped fresh ginger,tuna steaks (each about 4 ounces),Ginger Mayonnaise:,mayonnaise,chopped fresh ginger,soy sauce,sourdough bread,leaves red-leaf lettuce,California avocado peeled pitted lightly mashed",2017-03-23 16:10:29,10 mins,4 sandwiches,http://images.familycircle.mdpcdn.com/sites/familycircle.com/themes/meredith/images/recipe-default.png,  
"1  Heat oven to 375 degrees F. Line 151/4 x 101/4 x 1-inch jelly-roll pan with greased waxed paper.,2  Stir together flour, baking powder and salt in bowl.,3  Beat yolks and 1/4 cup granulated sugar in bowl until thick. Add vanilla and 1/8 teaspoon walnut extract. Fold in flour mixture and ground walnuts.,4  Beat whites and cream of tartar in clean bowl until foamy. Gradually add remaining 1/4 cup granulated sugar; continue beating until soft peaks form. Stir quarter of whites into batter. Gently fold in remaining whites. Spread evenly in jelly-roll pan.,5  Bake in 375 degrees F oven 10 to 12 minutes, until center springs back when gently pressed and top is golden. Loosen edges of cake from pan; invert onto clean towel, sprinkled with 1 tablespoon confectioners sugar. Remove paper. Starting at short side, roll up cake, with towel (photo 2). Place, seam side down, on rack to cool.,6  Melt chocolate and butter in top of double boiler over hot, not boiling, water. Reserve 3 strawberries. Very thinly slice remaining strawberries; toss with liqueur in a bowl.,7  Beat cream with remaining 2 tablespoons confectioners sugar and 1/8 teaspoon walnut extract in bowl.,8  Unroll cake. Trim off edges if crisp and cracked due to rolling. Reserve 3 tablespoons melted chocolate. Leaving 11/2-inch border at each short end, spread remaining chocolate over surface of roll. Arrange sliced strawberries over chocolate. Reserve 1/4 cup whipped cream. Spread remaining whipped cream over roll, leaving border at short ends. Reroll cake; place, seam side down, on large serving platter.,9  Spread remaining chocolate over top of cake. Garnish with remaining whipped cream and reserved whole strawberries.",Walnut Roulade With Chocolate And Fresh Strawberries,"3/4,1,1/4,4,1/2,1/2,1/4,1/2,4,1/8,3,6,3,1,1,1,cup,teaspoon,teaspoon,,cup,teaspoon,teaspoon,cup,,teaspoon,tablespoons,ounces,tablespoons,pint,tablespoon,cup,cake flour (not self-rising),baking powder,salt,egg yolks,granulated sugar,vanilla extract,walnut extract (optional),finely ground walnuts,egg whites,cream of tartar,confectioners sugar,semisweet chocolate,butter,strawberries,berry or orange liqueur,heavy cream",http://www.familycircle.com/recipe/desserts/walnut-roulade-with-chocolate-and-fresh-strawberries/,"cake flour (not self-rising),baking powder,salt,egg yolks,granulated sugar,vanilla extract,walnut extract (optional),finely ground walnuts,egg whites,cream of tartar,confectioners sugar,semisweet chocolate,butter,strawberries,berry or orange liqueur,heavy cream",2017-03-23 16:10:36,35 mins,10 servings,http://images.familycircle.mdpcdn.com/sites/familycircle.com/themes/meredith/images/recipe-default.png,  
"1  Heat oven to 400 degrees F. Grease 8-inch square metal baking pan.,2  Mix cornstarch, cinnamon, ginger and cloves in a bowl. Combine pears, brown sugar and 1-1/2 tablespoons granulated sugar in large bowl. Sprinkle pear mixture with cinnamon mixture; toss. Pour pear mixture into pan.,3  Stir together biscuit mix, milk and egg in clean bowl. Pour evenly over top of filling in pan. Sprinkle with remaining 1/2 tablespoon sugar.,4  Bake in 400 degree F oven 20 minutes. Lower temperature to 350 degrees F. Bake 25 to 30 minutes, until bubbly.,5  Serve warm. Garnish each serving with 1 tablespoon of the vanilla yogurt.",Spiced Pear Pot-Pie,"1 1/2,1,1/2,6,1/3,2,1,1/2,1,1,tablespoons,teaspoon,teaspoon,,,cup,tablespoons,cup,cup,,8,cornstarch,ground cinnamon,ground ginger,Pinch ground cloves,pears, sliced,packed light-brown sugar,granulated sugar,reduced-fat biscuit mix,nonfat milk,egg,low-fat vanilla yogurt",http://www.familycircle.com/recipe/desserts/spiced-pear-pot-pie/,"cornstarch,ground cinnamon,ground ginger,Pinch ground cloves,pears sliced,packed light-brown sugar,granulated sugar,reduced-fat biscuit mix,nonfat milk,egg,low-fat vanilla yogurt",2017-03-23 16:10:41,20 mins,8 servings,http://images.familycircle.mdpcdn.com/sites/familycircle.com/themes/meredith/images/recipe-default.png,  
"1  Heat oven to 350 degrees F.,2  In a large bowl, whisk flour, baking powder and salt. Set aside.,3  In another large bowl, beat butter and sugar until creamy, about 3 minutes. Beat in eggs and extracts. Beat in dry ingredients on low until just combined.,4  Place dough in a pastry bag fitted with a large star tip. Pipe stars, 2 inches apart, onto ungreased baking sheets. Place a glace cherry half on top of each. Refrigerate baking sheets for 30 minutes.,5  Bake at 350 degrees F for 10 to 12 minutes, until edges just start to brown.,6  Remove cookies from baking sheets to wire racks and let cool completely. Repeat with remaining dough.",Rum Butter Stars,"2 1/2,1/2,1/8,1,3/4,2,1,1/2,24,cups,teaspoon,teaspoon,cup,cup,,teaspoon,teaspoon,,all-purpose flour,baking powder,salt,(2 sticks) unsalted butter, softened,sugar,eggs,rum extract,vanilla extract,red and green glace cherries, halves",http://www.familycircle.com/recipe/cookies/rum-butter-stars/,"all-purpose flour,baking powder,salt,(2 sticks) unsalted butter softened,sugar,eggs,rum extract,vanilla extract,red and green glace cherries halves",2017-03-23 16:10:47,15 mins,48 servings,http://images.familycircle.mdpcdn.com/sites/familycircle.com/themes/meredith/images/recipe-default.png,
"1  Combine garlic, curry powder, 1 tablespoon oil, salt and pepper. Rub over chicken breasts.,2  Saute chicken in remaining 1 tablespoon oil in nonstick skillet, 4 minutes per side, until no longer pink in the center. Remove to plate.,3  Spread 1 tablespoon chutney over each breast; cover. Add green onions to skillet; cook 3 minutes. Spoon over chicken and serve.",Curried Chicken,"2,2,2,1/2,1/4,4,4,1,tablespoons,tablespoons,tablespoons,teaspoon,teaspoon,,tablespoons,bunch,chopped garlic,curry powder,oil,salt,pepper,boneless, skinless chicken breast halves, lightly pounded thin,chuntey,green onions, sliced in 1-inch pieces",http://www.familycircle.com/recipe/chicken/curried-chicken/,"chopped garlic,curry powder,oil,salt,pepper,boneless skinless chicken breast halves lightly pounded thin,chuntey,green onions sliced in 1-inch pieces",2017-03-23 16:10:54,5 mins,4 servings,http://images.familycircle.mdpcdn.com/sites/familycircle.com/themes/meredith/images/recipe-default.png,  
"1  Bring water and rind to simmering in saucepan. Simmer 15 minutes; drain. Set aside.,2  Meanwhile, season chicken with salt and pepper. Coat chicken on both sides with flour.,3  Heat 1 tablespoon butter in nonstick skillet. Add shallots and chicken; cook 3 to 4 minutes per side. Add tarragon, juice and granules; cook, turning once, 7 minutes, until chicken is no longer pink in center. Remove to platter.,4  Add orange sections and remaining butter to skillet. Gently heat, swirling pan, just until butter melts and is incorporated into sauce. Spoon pan sauce over chicken and serve, topped with the reserved orange rind strips.",Orange Chicken,"1 1/2,1/4,4,1/4,1/4,2,2,2,1/4,1,1/2,2,cups,cup,,teaspoon,teaspoon,tablespoons,tablespoons,,teaspoon,cup,teaspoon,,water,lightly packed thinly sliced orange rind,boneless, skinless chicken breast halves (about 1-1/2 pounds total),salt,pepper,all-purpose flour,butter,shallots, finely chopped,dried tarragon,orange juice,chicken bouillon granules,oranges, sectioned",http://www.familycircle.com/recipe/chicken/orange-chicken/,"water,lightly packed thinly sliced orange rind,boneless skinless chicken breast halves (about 1-1/2 pounds total),salt,pepper,all-purpose flour,butter,shallots finely chopped,dried tarragon,orange juice,chicken bouillon granules,oranges sectioned",2017-03-23 16:11:02,15 mins,4 servings,http://images.familycircle.mdpcdn.com/sites/familycircle.com/themes/meredith/images/recipe-default.png,  
"1  Grate the zest from the lime and reserve 3/4 teaspoon. Juice the lime.,2  In a shallow glass, ceramic or other nonreactive dish, combine lime zest and juice, olive oil, soy sauce, scallions and ginger and mix well. Add shrimp, turn to coat and refrigerate for 1 to 2 hours.,3  Prepare a charcoal or gas grill so that the coals or heating elements are medium-hot. Off the heat, lightly spray the grate with vegetable oil spray.,4  Soak the wooden skewers in cold water until ready to use.,5  Remove the shrimp from the marinade and discard the marinade. Thread 5 shrimp onto each skewer and grill for 2 to 3 minutes per side, or until golden brown and just cooked through. Serve immediately with the Peanut Dipping Sauce.,6  In a small saute pan, heat oil over medium heat until shimmering. Add garlic and saute for about 1 minute, or until lightly golden brown. Add red pepper flakes and saute for a few seconds. Stir in hoisin sauce, peanut butter and water, and reduce heat to medium-low so the sauce simmers gently. Add lime juice and simmer, stirring, for 3 to 4 minutes to allow the flavors to blend. Let the sauce cool to room temperature.",Grilled Shrimp Satay with Ginger & Lime,"1,3,3,2,1 1/2,20,,tablespoons,tablespoons,,teaspoons,large,,,,lime,olive oil,soy sauce,scallions, white and green parts, finely chopped,grated fresh ginger,shrimp (about 1-1/2 pounds total), peeled and deveined,Flavorless vegetable oil spray,4 wooden skewers, 8 to 10 inches long,Peanut Dipping Sauce (recipe follows)",http://www.familycircle.com/recipe/appetizers-snacks/grilled-shrimp-satay-with-ginger-lime/,"lime,olive oil,soy sauce,scallions white and green parts finely chopped,grated fresh ginger,shrimp (about 1-1/2 pounds total) peeled and deveined,Flavorless vegetable oil spray,4 wooden skewers 8 to 10 inches long,Peanut Dipping Sauce (recipe follows)",2017-03-23 16:11:03,10 mins,4 servings,http://images.familycircle.mdpcdn.com/sites/familycircle.com/themes/meredith/images/recipe-default.png,  
"1  Cook the carrots in a large quantity of lightly salted boiling water in a large saucepan for 10 minutes. Drain well.,2  Heat butter in medium-size skillet over medium heat. Add sugar, stirring until smooth. Add carrots, nutmeg and salt; cook over medium heat, stirring occasionally, until carrots are tender and coated with the glaze, about 8 to 12 minutes.",Glazed Carrots,"1,3,2,1/8,1/8,pound,tablespoons,tablespoons,teaspoon,teaspoon,peeled baby carrots,butter,dark-brown sugar,ground nutmeg,salt",http://www.familycircle.com/recipe/vegetables/glazed-carrots/,"peeled baby carrots,butter,dark-brown sugar,ground nutmeg,salt",2017-03-23 16:11:11,5 mins,6 servings,http://images.familycircle.mdpcdn.com/sites/familycircle.com/themes/meredith/images/recipe-default.png,  
"1  Bring broth, 3/4 cup water and 1/2 teaspoon salt to boiling in saucepan. Stir in rice; cover. Cook over medium-low heat until tender, 10 minutes.,2  Place peas and shrimp in colander set in sink. Run lukewarm water over until thawed.,3  Stir peas and shrimp into rice. Stir in Parmesan. Spoon into bowls. Sprinkle with cheese to taste.",Creamy Rice with Shrimp and Peas,"1,2,1,1,1/3,13 3/4,cups,10,pound,cup,chicken broth,quick-cooking brown rice,frozen peas,shelled and deveined fully cooked small shrimp,grated Parmesan cheese, plus more to taste",http://www.familycircle.com/recipe/vegetables/creamy-rice-with-shrimp-and-peas/,"chicken broth,quick-cooking brown rice,frozen peas,shelled and deveined fully cooked small shrimp,grated Parmesan cheese plus more to taste",2017-03-23 16:11:17,10 mins,4 servings,http://images.familycircle.mdpcdn.com/sites/familycircle.com/themes/meredith/images/recipe-default.png,  
