direction,name,ingredients,url,products,crawl_time,prep_time,servings,img_url,description
"1  Heat oven to 325 degrees F.,2  In food processor or heavy plastic bag, crush graham crackers until fine crumbs. Transfer to small bowl. Stir in melted butter and honey until crumbs are evenly moistened. Transfer crumbs to four 4-inch springform pans (see Note), about 1/3 cup crumbs per pan, or to a 8-inch springform pan. Press crumbs evenly over bottom(s).,3  Bake in 325 degree F oven for 10 minutes. Transfer to wire rack.,4  In medium-size bowl, beat together cream cheeses until smooth. Add confectioners sugar, lemon rind and lemon juice; beat until thick and smooth. Add egg whites; beat until creamy consistency.,5  Divide batter evenly among crumb-lined pans, about 1/2 cup per pan, or scrape into large springform pan.,6  Bake in 325 degree F oven until top is set and smooth, about 20 minutes for smaller pans, 30 minutes for large pan. Transfer to wire rack; let cool until room temperature. Refrigerate at least 1 hour or until serving.,7  To serve, run thin knife around inside edge of pan(s). Release side; remove from bottom using thin spatula. Garnish with thin slice of lemon if desired. Serve chilled. Makes four 4-inch cheesecakes (2 servings each).",Lemon Cheesecakes,"1,4,2,1,1,2/3,1,2,2,,,tablespoons,tablespoons,,,8,8,cup,teaspoon,tablespoons,,,Crust:,packet (9 boards) regular or low-fat cinnamon graham crackers,butter, melted,honey,Pinch salt,Filling:,regular cream cheese, at room temperature,1/3-less-fat cream cheese (Neufchatel), at room temperature,confectioners sugar,grated lemon rind,fresh lemon juice,egg whites,Thin lemon slices, for garnish (optional)",http://www.familycircle.com/recipe/cakes/lemon-cheesecakes/,"Crust:,packet (9 boards) regular or low-fat cinnamon graham crackers,butter melted,honey,Pinch salt,Filling:,regular cream cheese at room temperature,1/3-less-fat cream cheese (Neufchatel) at room temperature,confectioners sugar,grated lemon rind,fresh lemon juice,egg whites,Thin lemon slices for garnish (optional)",2017-03-23 16:24:44,30 mins,8 servings,http://images.meredith.com/bhg/images/recipe/p_R074510.jpg,  
"1  Stir honey into 1/4 cup warm water in small bowl. Sprinkle with yeast. Let stand until foamy, 5 to 10 minutes.,2  Combine bread and all-purpose flours, sugar, salt and 1/4 cup toasted sesame seeds in large bowl. Stir in yeast mixture, remaining 3/4 cup warm water and sesame oil. Stir until dough pulls away from sides of bowl.,3  Turn dough out onto lightly floured surface. Knead dough until smooth and elastic, 8 to 10 minutes, adding more flour as needed to prevent dough from sticking. Place dough in greased bowl, turning to coat. Cover with clean kitchen towel or plastic wrap. Let rise in warm place until doubled in volume, 45 minutes to 1 hour.,4  Punch dough down. Let rest 5 minutes. On lightly floured surface, roll dough into 16 x 9-inch rectangle. Using a pizza cutter or sharp knife and beginning at a long side, cut dough into sixteen 1-inch-wide strips. Dust 2 baking sheets with cornmeal. Transfer breadsticks to pans.,5  Brush sticks with egg white. Sprinkle with salt and sesame seeds. Cover with clean dish towel. Let rise until doubled in volume, 45 minutes to 1 hour.,6  Heat oven to 425 degrees F. Bake breadsticks for 12 to 15 minutes or until golden and hard on outside. Serve warm.",Sesame Breadsticks,"1,1,1,1 1/2,1 1/2,1,1,1/4,2,1,1,1,teaspoon,cup,,cups,cups,teaspoon,teaspoon,cup,tablespoons,,,teaspoon,tablespoon,honey,warm water (105 degrees F to 115 degrees F),envelope active dry yeast,bread flour,all-purpose flour,sugar,salt,sesame seeds, toasted,dark Asian sesame oil,Cornmeal, for dusting,egg white, lightly beaten,coarse salt,sesame seeds, toasted",http://www.familycircle.com/recipe/breads/sesame-breadsticks/,"honey,warm water (105 degrees F to 115 degrees F),envelope active dry yeast,bread flour,all-purpose flour,sugar,salt,sesame seeds toasted,dark Asian sesame oil,Cornmeal for dusting,egg white lightly beaten,coarse salt,sesame seeds toasted",2017-03-23 16:24:49,25 mins,about 16 breadsitcks,http://images.meredith.com/bhg/images/recipe/p_FC3083.jpg,  
"1  Mix flour and salt in bowl. Cut in shortening and butter with pastry blender until mixture resembles coarse meal.,2  Sprinkle ice water, a tablespoon at a time, and vinegar, over flour mixture, tossing with fork after each addition, until just moist enough to form mass. Shape into 5-inch disk. Cover with plastic wrap. Refrigerate until thoroughly chilled, about 1 hour.,3  Heat oven to 325 degrees F.,4  Roll out dough on floured surface into 11-inch round. Fit in 9-inch pie plate. Fold overhanging pastry under to make edge; press all around edge with tines of fork.,5  Heat sugar, syrup, butter, cinnamon, cloves and salt in saucepan over medium heat to melt butter. Off heat, whisk in eggs, one at a time. Add almonds and hazelnuts. Pour into shell. Arrange pecans in circles, beginning at outside and working towards center.,6  Bake in 325 degrees F oven 50 minutes, until golden brown and knife inserted near center tests clean. Cool.",Three-nut Pie,"1 1/4,1/4,1/3,1,3,1,3/4,3/4,1/4,1 1/2,1/8,1/4,4,3/4,1/2,1,cups,teaspoon,cup,tablespoon,tablespoons,teaspoon,cup,cup,cup,teaspoons,teaspoon,teaspoon,,cup,cup,cup,all-purpose flour,salt,shortening, chilled and cut into small pieces,butter, chilled and cut into small pieces,ice water,cider vinegar,packed dark-brown sugar,dark or light corn syrup,(1/2 stick) butter,ground cinnamon,ground cloves,salt,eggs,blanched slivered almonds,chopped hazelnuts,pecan halves",http://www.familycircle.com/recipe/pies/three-nut-pie/,"all-purpose flour,salt,shortening chilled and cut into small pieces,butter chilled and cut into small pieces,ice water,cider vinegar,packed dark-brown sugar,dark or light corn syrup,(1/2 stick) butter,ground cinnamon,ground cloves,salt,eggs,blanched slivered almonds,chopped hazelnuts,pecan halves",2017-03-23 16:24:53,30 mins,10 servings,http://images.meredith.com/bhg/images/recipe/p_FC3556.jpg,  
"1  Bring nuts, water and honey in small saucepan to boiling over medium heat; cook 5 to 8 minutes, until water boils away and nuts begin to sizzle. When coated, remove nuts to heat-proof plate to dry. (Can be prepared ahead.),2  Mix shrimp, 2 tablespoons sherry and ginger in bowl; refrigerate at least 1 hour.,3  Combine remaining 2 tablespoons sherry, chicken broth, soy sauce, ketchup, sugar, vinegar, cornstarch, sesame oil and ground red pepper in small bowl.,4  Heat 1 tablespoon oil in large skillet over high heat. Add honey walnuts to skillet; stir-fry until crisp and brown, about 2 or 3 minutes. Turn out onto heat-proof plate.,5  Heat 1 tablespoon oil in same skillet. Drain shrimp. Add shrimp, scallions, red pepper and garlic to skillet; stir-fry 3 to 5 minutes or until vegetables are crisp-tender and shrimp are pink and curled. Remove to large platter; keep warm.,6  Wipe out skillet. Heat remaining oil in skillet. Add snow peas; stir-fry 1 minute, just until tender. Return shrimp and vegetables to skillet. Stir in ketchup-cornstarch mixture. Bring to boiling; cook, stirring frequently, until thickened, 2 to 3 minutes.,7  Serve shrimp over hot rice if desired. Top with honey walnuts.",Stir-Fried Shrimp with Honey Walnuts,"2/3,1/2,1,1,1/4,1,3/4,3,2,2,2,1 1/2,1,1/8,3,8,1,2,1,cup,cup,tablespoon,pound,cup,tablespoon,cup,tablespoons,tablespoons,tablespoons,tablespoons,tablespoons,teaspoon,teaspoon,tablespoons,,,,pound,,walnut halves,water,honey,large shrimp, shelled and deveined,dry sherry,grated fresh ginger,chicken broth,soy sauce,ketchup,sugar,rice vinegar or white vinegar,cornstarch,dark Asian sesame oil,ground red pepper,vegetable oil,scallions, diagonally cut into 11/2-inch pieces,red sweet pepper, cored, seeded and cut in 1-inch pieces,cloves garlic, finely chopped,snow peas, trimmed and strings removed,Hot cooked rice (optional)",http://www.familycircle.com/recipe/seafood/stir-fried-shrimp-with-honey-walnuts/,"walnut halves,water,honey,large shrimp shelled and deveined,dry sherry,grated fresh ginger,chicken broth,soy sauce,ketchup,sugar,rice vinegar or white vinegar,cornstarch,dark Asian sesame oil,ground red pepper,vegetable oil,scallions diagonally cut into 11/2-inch pieces,red sweet pepper cored seeded and cut in 1-inch pieces,cloves garlic finely chopped,snow peas trimmed and strings removed,Hot cooked rice (optional)",2017-03-23 16:25:02,45 mins,6 servings,http://images.meredith.com/bhg/images/recipe/p_FC3340.jpg,  
"1  Heat oven to 350 degrees F. Line a jumbo cupcake pan with 6 foil or paper liners.,2  In a bowl, whisk flour, baking powder, baking soda, allspice, ginger, salt.,3  In a large bowl, beat together maple syrup and half the milk.  Beat in flour mixture and shortening until blended; 4 minutes.  Beat in eggs and remaining milk until smooth.  Stir in carrots and pineapple.,4  Divide batter evenly among prepared cupcake liners, 2/3 cup batter in each.  Bake at 350 degrees F for 28 minutes, or until lightly browned.  Remove from pan; cool on rack.,5  In a medium-size bowl, beat together cream cheese and butter.  Beat in sugar until smooth.  Place 2/3 cup frosting in a bowl; tint with food coloring. Transfer to a pastry bag fitted with a small round tip.  Spread white frosting over cakes.  Pipe a spiral on top of cakes with tinted icing.  Starting in center, draw a knife outward through spiral to create a spider-web.",Maple-Carrot Cupcakes,"1 1/2,1 1/4,1/2,1/2,1/2,1/2,3/4,1/2,2/3,2,1,1,1,1/4,1 1/2,cups,teaspoons,teaspoon,teaspoon,teaspoon,teaspoon,cup,cup,cup,,medium,can,tub,cup,cups,,all-purpose flour,baking powder,baking soda,ground allspice,ground ginger,salt,maple syrup,milk,solid vegetable shortening,eggs,carrot, shredded,(8 ounces) crushed pineapple, drained,(8 ounces) cream cheese,(1/2 stick) unsalted butter, softened,confectioners sugar,Burgundy food coloring",http://www.familycircle.com/recipe/cupcakes/maple-carrot-cupcakes/,"all-purpose flour,baking powder,baking soda,ground allspice,ground ginger,salt,maple syrup,milk,solid vegetable shortening,eggs,carrot shredded,(8 ounces) crushed pineapple drained,(8 ounces) cream cheese,(1/2 stick) unsalted butter softened,confectioners sugar,Burgundy food coloring",2017-03-23 16:25:09,15 mins,6 jumbo cupcakes,http://images.familycircle.mdpcdn.com/sites/familycircle.com/themes/meredith/images/recipe-default.png,  
"1  Heat oven to 350 degrees . Coat 2 large baking sheets with cooking spray.,2  In medium-size bowl, whisk together flour and salt.,3  In large bowl, on medium-high speed, beat together butter, sugar and extract until creamy, about 2 minutes. Stir in flour mixture, nuts and pineapple until dough forms.,4  Divide dough into 6 equal pieces. Roll each piece into a ball. Place 3 balls on a prepared baking sheet; flatten each into 5-inch round. Smooth edge; press tines of fork around edge. Cut each into 8 equal triangles; do not pull apart. Repeat with remaining dough and second baking sheet.,5  Bake in 350 degrees  oven for about 15 minutes or until just lightly golden.,6  While still hot, recut rounds into triangles. Transfer to rack; let cool.,7  In small bowl, stir together sugar and juice until smooth. Divide icing in half; tint half with red food color. Spoon each icing into a pastry bag fitted with a small writing tip. Pipe alternating stripes into indentations on each cookie. Let dry.",Pineapple-Macadamia Triangles,"2 1/2,1/4,1,2/3,1,1,1/2,1 1/2,6,cups,teaspoon,cup,cup,teaspoon,cup,cup,cups,teaspoons,,all-purpose flour,salt,(2 sticks) unsalted butter, at room temperature,granulated sugar,rum extract or vanilla extract,macadamia nuts, finely chopped,chopped dried pineapple,confectioners sugar,pineapple juice,Red food coloring",http://www.familycircle.com/recipe/cookies/pineapple-macadamia-triangles/,"all-purpose flour,salt,(2 sticks) unsalted butter at room temperature,granulated sugar,rum extract or vanilla extract,macadamia nuts finely chopped,chopped dried pineapple,confectioners sugar,pineapple juice,Red food coloring",2017-03-23 16:25:13,20 mins,48 servings,http://images.meredith.com/bhg/images/recipe/p_FC11679.jpg,  
"1  Heat oven to 450 degrees F. Coat a baking dish with nonstick cooking spray.,2  In a small dish, stir together the hoisin, soy sauce, vinegar, ginger and red pepper flakes. Place salmon in prepared dish and spread top of each fillet with half of the hoisin mixture.,3  Roast at 450 degrees F for 10 minutes. Spread remaining hoisin mixture over the salmon and top with the scallions. Roast for an additional 5 minutes.,4  Serve with rice and broccoli, and lemon wedges for garnish, if desired.",Spicy Hoisin Salmon,"1/4,2,2,1/2,1/4,4,2,cup,tablespoons,teaspoons,teaspoon,teaspoon,pieces,,,hoisin sauce,reduced-sodium soy sauce,rice vinegar,ground ginger,red pepper flakes,salmon fillet, about 6 ounces each,scallions, trimmed and thinly sliced,White rice and broccoli, and lemon wedges for garnish, optional",http://www.familycircle.com/recipe/seafood/spicy-hoisin-salmon/,"hoisin sauce,reduced-sodium soy sauce,rice vinegar,ground ginger,red pepper flakes,salmon fillet about 6 ounces each,scallions trimmed and thinly sliced,White rice and broccoli and lemon wedges for garnish optional",2017-03-23 16:25:21,10 mins,4 servings,http://images.meredith.com/bhg/images/recipe/p_R123137.jpg,  
"1  Bring a large pot of lightly salted water to a boil.,2  Heat 2 tablespoons the olive oil in a large skillet over medium heat. Add green pepper and cook 2 minutes. Add garlic and anchovies and cook for 1 minute, mashing anchovies with spoon.,3  Add tomatoes, salt and pepper. Cook 5 minutes, stirring.,4  While sauce is cooking, prepare pasta following package directions. Drain, reserving 1 cup cooking water.,5  Toss pasta with tomato mixture and remaining tablespoon olive oil. Add 1/4 cup pasta water if needed. Serve with cheese.","Spaghetti with Tomato, Green Pepper and Anchovy","3,1,4,2,2,1/4,1/4,1,1/2,tablespoons,,,tins,pints,teaspoon,teaspoon,pound,cup,olive oil,large green pepper, seeded and thinly sliced,cloves garlic, chopped,(2 ounces each) anchovies in oil, drained (see Note),grape tomatoes, halved (about 4 cups),salt,black pepper,uncooked spaghetti,shredded Parmesan cheese",http://www.familycircle.com/recipe/pasta/spaghetti-with-tomato-green-pepper-and-anchovy/,"olive oil,large green pepper seeded and thinly sliced,cloves garlic chopped,(2 ounces each) anchovies in oil drained (see Note),grape tomatoes halved (about 4 cups),salt,black pepper,uncooked spaghetti,shredded Parmesan cheese",2017-03-23 16:25:26,10 mins,6 servings,http://images.meredith.com/bhg/images/recipe/p_R116959.jpg,  
"1  Stir 1 cup of the milk together with the cornmeal. Place remaining milk in a large saucepan. Bring to a simmer over medium heat; when milk is gently bubbling, stir in cornmeal mixture, salt and pepper. Continue stirring over medium heat until thickened, about 12 minutes. Remove from heat; stir in Parmesan. Let cool. Place plastic wrap on surface of polenta and refrigerate until ready to serve .,2  To serve, place saucepan over low heat; stir in enough milk to make mixture soft and creamy (you may need up to 1 cup). Reheat until warmed through.",Creamy Polenta,"3 1/2,1,1/2,1/4,1/2,cups,cup,teaspoon,teaspoon,cup,lowfat milk,white cornmeal,garlic salt,black pepper,grated Parmesan",http://www.familycircle.com/recipe/grains/creamy-polenta/,"lowfat milk,white cornmeal,garlic salt,black pepper,grated Parmesan",2017-03-23 16:25:37,5 mins,8 servings,http://images.meredith.com/bhg/images/recipe/p_R109853.jpg,  
"1  In 3-quart saucepan, combine salsa, corn, chicken broth and Italian seasoning. Bring to simmering over medium-high heat.,2  Stir in shrimp and potato flakes; simmer until shrimp are firm and broth is slightly thickened, 1 to 2 minutes.",Quick Shrimp and Corn Chowder,"1,1,1,1/2,1,3,jar,can,can,teaspoon,pound,tablespoons,(11 to 16 ounces) corn and black bean salsa, mild or medium heat,(15.25 ounces) corn kernels, drained,(14.5 ounces) chicken broth,dried Italian herb seasoning,medium-size shrimp, peeled and cleaned (about 3/4 pound cleaned shrimp),instant mashed potato flakes",http://www.familycircle.com/recipe/soups/quick-shrimp-and-corn-chowder/,"(11 to 16 ounces) corn and black bean salsa mild or medium heat,(15.25 ounces) corn kernels drained,(14.5 ounces) chicken broth,dried Italian herb seasoning,medium-size shrimp peeled and cleaned (about 3/4 pound cleaned shrimp),instant mashed potato flakes",2017-03-23 16:25:40,5 mins,4 servings,http://images.meredith.com/bhg/images/recipe/p_R077938.jpg,  
"1  Heat oil in large, heavy pot over medium-high heat. Add onion, pepper; cook, stirring occasionally, 5 to 6 minutes. Add garlic and chicken; cook 5 minutes. Add chili powder, cumin, chopped chipotles and adobo sauce; cook, stirring, 1 minute. Add broth and salt. Cover; simmer 15 minutes.,2  Mash 1 can cannellini beans. Add all the beans and corn to pot. Simmer, uncovered, for 10 minutes. Let stand 10 minutes.,3  If desired, serve over corn chips and garnish with lime wedges and cilantro.",Chicken and Vegetable Chili,"3,2,1,3,2,3,2,2,1,2,1 1/2,2,1,1,tablespoons,,,,pounds,tablespoons,teaspoons,,tablespoon,cans,teaspoons,cans,can,box,olive oil,onions, chopped,green pepper, diced,cloves garlic, chopped,boneless skinless chicken breasts, in bite-size pieces,chili powder,ground cumin,chipotles in adobo, seeded and chopped,adobo sauce,chicken broth,salt,(15 ounces each) cannellini beans, drained and rinsed,(15 ounces) pinto beans, drained and rinsed,(10 ounces) frozen corn kernels",http://www.familycircle.com/recipe/chicken/chicken-and-vegetable-chili/,"olive oil,onions chopped,green pepper diced,cloves garlic chopped,boneless skinless chicken breasts in bite-size pieces,chili powder,ground cumin,chipotles in adobo seeded and chopped,adobo sauce,chicken broth,salt,(15 ounces each) cannellini beans drained and rinsed,(15 ounces) pinto beans drained and rinsed,(10 ounces) frozen corn kernels",2017-03-23 16:25:53,20 mins,8 servings,http://images.meredith.com/bhg/images/recipe/p_R094647.jpg,  
"1  Mix together 2 tablespoons mustard, the melted butter, 1/2 teaspoon salt and 1/8 teaspoon pepper. Brush mixture all over chicken; coat with ground pecans. Place on waxed-paper-lined baking sheet and refrigerate for 15 minutes.,2  Heat oil in large nonstick skillet over medium-high heat. Working in batches if necessary to avoid crowding, add chicken to skillet; saute until browned, about 6 minutes per side (170 degrees F). Remove skillet from heat; reduce heat to low. Remove chicken to platter and keep warm. Wipe out skillet with clean paper toweling.,3  Add sour cream and remaining mustard, salt and pepper to skillet, stirring until well blended. Gently heat through; do not let boil. Pour over chicken and serve immediately.",Pecan-Crusted Chicken Cutlets,"4,1,3/4,1/4,4,2/3,2,1,tablespoons,tablespoon,teaspoon,teaspoon,,cup,tablespoons,cup,Dijon mustard,butter or margarine, melted,salt,black pepper,boneless, skinless chicken breast halves (1 pound total),pecans, finely ground,oil,reduced-fat sour cream",http://www.familycircle.com/recipe/chicken/pecan-crusted-chicken-cutlets/,"Dijon mustard,butter or margarine melted,salt,black pepper,boneless skinless chicken breast halves (1 pound total),pecans finely ground,oil,reduced-fat sour cream",2017-03-23 16:26:02,20 mins,4 servings,http://images.meredith.com/bhg/images/recipe/p_FC2575.jpg,  
"1  If using a ready-to-roll crust, fit into the bottom and up sides of a 9-inch glass pie plate. Flute the edge decoratively. If making crust from scratch (see recipe below, roll pastry into 12-inch circle; fit into bottom and up sides of pie plate. Trim overhang; flute edge. Sprinkle chopped pecans evenly over the crust.,2  Bring large pot of water to a boil. Drop in the peaches; boil until the skins peel off easily, about 2 minutes. Using a slotted spoon, quickly transfer the peaches to a bowl of cold water; let cool slightly. Remove the peaches from the water; peel off the skins and discard. Halve peaches; remove pits. Quarter each half in wedges.,3  Place oven rack in lowest position. Heat oven to 400 degrees .,4  In a medium-size bowl, toss together the peach slices, granulated sugar, cornstarch and allspice until well blended. Spoon the peach mixture into the pie shell, spreading evenly and mounding slightly.,5  In a medium-size bowl, mix together the flour, light-brown sugar and cinnamon until well blended. Work in the butter with your fingertips until medium-size crumbs form and the dry ingredients are evenly moistened (see photo 1, at right). Lightly toss in pecans until well distributed (photo 2). Sprinkle and mound the streusel over the top of the peach mixture (photo 3).,6  Bake the pie on the lowest rack in 400 degrees  oven for 10 minutes. Reduce the oven temperature to 350 degrees . Bake for another 65 minutes or until the filling is bubbling around edge and the piecrust and streusel are browned. Transfer pie to wire rack; let cool until you can comfortably hold bottom of pie plate, about 1 hour.,7  Slice the pie and serve with whipped cream, ice cream or whipped topping, if desired.Homemade Pastry: In bowl, mix 1 1/4 cups flour and 1/2 teaspoon salt. Cut in 1 stick cold butter with pastry blender. Slowly add 3 to 4 tablespoons cold water to flour, tossing with a fork to combine. Shape dough into ball and press into a disk. Wrap and chill 30 minutes. On a lightly floured surface, roll chilled dough into a 12-inch round.",Streusel-Topped Peach Pie,"1,3,1 1/2,3,3,1/4,1,1/2,1,6,3/4,,tablespoons,pounds,tablespoons,tablespoons,teaspoon,cup,cup,teaspoon,tablespoons,cup,,unbaked single-crust pie shell, preformed or ready-to-roll, thawed if frozen OR: homemade pastry (see photos 14, below),finely chopped pecans,peaches,granulated sugar,cornstarch,ground allspice,all-purpose flour,firmly packed light-brown sugar,ground cinnamon,(3/4 stick) butter, cut into pieces and at room temperature,pecans, chopped,Whipped cream, ice cream or whipped topping",http://www.familycircle.com/recipe/pies/streusel-topped-peach-pie/,"unbaked single-crust pie shell preformed or ready-to-roll thawed if frozen OR: homemade pastry (see photos 14 below),finely chopped pecans,peaches,granulated sugar,cornstarch,ground allspice,all-purpose flour,firmly packed light-brown sugar,ground cinnamon,(3/4 stick) butter cut into pieces and at room temperature,pecans chopped,Whipped cream ice cream or whipped topping",2017-03-23 16:26:09,45 mins,8 servings,http://images.meredith.com/bhg/images/recipe/p_FC3387.jpg,  
"1  Heat oven to 350 degrees F. Coat 13 x 9 x 2-inch baking dish with cooking spray.,2  Cook shells in lightly salted boiling water for 13 minutes, following package directions. Drain.,3  In large heavy-bottomed saucepan (not nonstick), melt butter over medium heat. Stir in flour until well blended; cook for 1 minute. Whisk in 1 cup half-and-half; cook, whisking continuously, until very smooth. Whisk in remaining 1 cup half-and-half; continue to cook, whisking until thickened and smooth, about 6 minutes. Remove from heat. Stir in Chipotle Seasoning, salt, 1 cup of Jack cheese and 1 cup of cheddar cheese until smooth.,4  Stir ham and cheese sauce into pasta. Spoon into prepared dish. Top with remaining cheeses.,5  Bake in 350 degrees F oven until bubbly and lightly golden on top, about 30 minutes. Remove from oven to rack; let stand 10 minutes before serving.",Chipotle Mac and Cheese,"1,2,2,2,3/4,1/2,1,1,1,pound,tablespoons,tablespoons,cups,teaspoon,teaspoon,8,8,1,medium-size pasta shells,butter,all-purpose flour,half-and-half,Chipotle Seasoning,salt,shredded Monterey Jack cheese,shredded sharp cheddar cheese,ham steak, trimmed of excess fat and meat cut into 1/4-inch dice",http://www.familycircle.com/recipe/pork/chipotle-mac-and-cheese/,"medium-size pasta shells,butter,all-purpose flour,half-and-half,Chipotle Seasoning,salt,shredded Monterey Jack cheese,shredded sharp cheddar cheese,ham steak trimmed of excess fat and meat cut into 1/4-inch dice",2017-03-23 16:26:18,15 mins,12 servings,http://images.meredith.com/bhg/images/recipe/p_FC11771.jpg,  
"1  Heat oil in 8- to 10-quart heavy-bottomed pot. Add onion, garlic and sweet peppers; cook until peppers are tender, 8 minutes. Add salt, black pepper, thyme, pepper flakes and turmeric; cook 1 minute. Add broth, water, peas and shrimp; simmer, covered, 2 minutes.,2  Remove from heat. Stir in couscous; cover; let stand 5 minutes. Serve, garnished with olives.",Couscous Paella With Shrimp,"2,1,3,1,1,1,1/2,1/2,1/2,1/2,1,1,1,1 1/2,1,1/2,tablespoons,,,,,teaspoon,teaspoon,teaspoon,teaspoon,teaspoon,14 1/2,cup,10,pounds,10,cup,olive oil,medium-size onion, chopped,cloves garlic, chopped,medium-size sweet red pepper, cut into 1/2-inch dice,medium-size sweet yellow pepper, cut into 1/2-inch dice,salt,black pepper,dried thyme,red-pepper flakes,ground turmeric,chicken broth,water,frozen peas, thawed,shrimp, shelled and cleaned,couscous,pitted black olives, sliced",http://www.familycircle.com/recipe/vegetables/couscous-paella-with-shrimp/,"olive oil,medium-size onion chopped,cloves garlic chopped,medium-size sweet red pepper cut into 1/2-inch dice,medium-size sweet yellow pepper cut into 1/2-inch dice,salt,black pepper,dried thyme,red-pepper flakes,ground turmeric,chicken broth,water,frozen peas thawed,shrimp shelled and cleaned,couscous,pitted black olives sliced",2017-03-23 16:26:23,20 mins,6 servings,http://images.meredith.com/bhg/images/recipe/p_FC1114.jpg,  
