direction,name,ingredients,url,products,crawl_time,prep_time,servings,img_url,description
"1  Heat oven to 400 degrees F. Grease 2 cookie sheets. On floured work surface, roll out dough to 1/4-inch thickness. Cut out circles, using 3 1/2-inch and 3-inch cutters. Transfer to cookie sheets. Using skewer, make small hole through dough about 1/2 inch from edge.,2  Bake in 400 degrees F oven for 10 to 12 minutes, until cookies darken around edges. Immediately re-shape holes since they may have shrunk during baking. Transfer cookies to wire rack; let cool.,3  Trace bauble templates onto sheet of paper; cut out.,4  Set a quarter of icing aside. Divide remaining icing among 3 small bowls. Tint one red, one blue and one green. Thin each batch with a few drops of water until consistency of thick heavy cream. Cover with plastic wrap or waxed paper pressed onto icing.,5  Arrange cookies in single layer on wire rack; place tray or sheet of parchment paper underneath. Position large bauble template on one large cookie. Add a small amount of reserved white icing to piping bag fitted with medium-size writing tip. Pipe line onto cookie around curved edges of template. Repeat for all cookies, using smaller template on small cookies. Pipe circle of icing around holes. Squeeze extra icing back into bowl and cover.,6  Place red icing into another piping bag or plastic-food storage bag with snipped-off tip. Use to flood top and bottom area of each bauble. Ease icing over edges with fine paintbrush to completely coat cookie. Let dry, at least 1 hour.,7  Place blue icing in separate piping bag as above. Flood central areas of each cookie. If necessary, use paintbrush to take blue icing right up to white, iced lines. Let cookies dry overnight.,8  Fill bag with remaining white icing. Onto blue areas, pipe outlines of trees onto half the cookies; pipe star at tip of some. Pipe dots of white icing around trees. Pipe white, holly-shaped outlines in blue area on remaining baubles, with dots for berries. Dry completely.,9  Place green icing in separate piping bag. Fill tree and holly shapes. Ease icing into corners of shapes with paintbrush. Fill berry outlines with dots of red icing. Let cookies dry overnight. Use more white icing to pipe over the initial template lines. Thread baubles with lengths of ribbon for hanging.",Christmas Baubles,"3,,,,Gingerbread cookie dough (your favorite recipe or see Gingerbread Houses recipe on www.familycircle.com),recipes Royal Icing (see recipe on www.familycircle.com),Red, blue and green soft gel paste food colors (see Note)",http://www.familycircle.com/recipe/cookies/christmas-baubles/,"Gingerbread cookie dough (your favorite recipe or see Gingerbread Houses recipe on www.familycircle.com),recipes Royal Icing (see recipe on www.familycircle.com),Red blue and green soft gel paste food colors (see Note)",2017-03-23 15:57:05,30 mins,12 large and 12 smaller baubles,http://images.familycircle.mdpcdn.com/sites/familycircle.com/themes/meredith/images/recipe-default.png,
"1  Heat oven to 375 degrees F.,2  Unroll dough into 4 rectangles. Spread each rectangle with 1 teaspoon mustard. Top each with 1 slice roast beef, cheese and one-quarter of chiles.,3  Beginning at short ends, roll up. Pinch seams closed. Place, seam sides down, on baking sheet. Slash tops.,4  Bake in 375 degree F oven 15 minutes, until golden and crisp. Serve warm.",Philly Steak Pockets,"1,4,4,4,1,8,teaspoons,slices,slices,4,crescent roll dough,yellow mustard,roast beef,American cheese,diced green chiles, drained",http://www.familycircle.com/recipe/sandwiches/philly-steak-pockets/,"crescent roll dough,yellow mustard,roast beef,American cheese,diced green chiles drained",2017-03-23 15:57:13,10 mins,4 servings,http://images.familycircle.mdpcdn.com/sites/familycircle.com/themes/meredith/images/recipe-default.png,  
"1  Heat oven to 350 degrees F. Coat baking sheets with nonstick cooking spray.,2  Place cake mix, water, melted butter and egg in large bowl. Beat on low speed 1 minute. Stop machine; scrape down sides of bowl with rubber spatula. Increase speed to medium; beat 1 minute. Dough will be thick. Fold in chips and nuts.,3  Drop heaping teaspoons of dough 2 inches apart on prepared baking sheets.,4  Bake in 350 degrees F oven until cookies have set but are still a little soft in center, 10 to 12 minutes. Cool cookies on sheets on wire rack 1 minute. Remove cookies with a metal spatula to wire racks to cool completely.",Double Chocolate Chewies,"1,1/3,1/4,1,1,1/2,18 1/4,cup,cup,,6,cup,plain devils food cake mix,water,(1/2 stick) butter, melted,egg,semisweet chocolate chips (1 cup),chopped walnuts, pecans or hazelnuts",http://www.familycircle.com/recipe/cookies/double-chocolate-chewies/,"plain devils food cake mix,water,(1/2 stick) butter melted,egg,semisweet chocolate chips (1 cup),chopped walnuts pecans or hazelnuts",2017-03-23 15:57:20,5 mins,4 dozen,http://images.familycircle.mdpcdn.com/sites/familycircle.com/themes/meredith/images/recipe-default.png,  
"1  Melt the butterscotch pieces with 1 tablespoon milk in a bowl over simmering water in a saucepan; stir until smooth. Whisk in the cream cheese until smooth. Evenly divide among phyllo cups, using about 1 teaspoon filling per cup. Refrigerate until chilled.,2  Melt the chocolate pieces with the remaining tablespoon milk in a clean bowl over simmering water in a saucepan. Spoon into a pastry bag fitted with a medium-large round tip. Pipe a large dot of chocolate onto top of the butterscotch filling in each phyllo cup. Top each cup with a pecan half, pressing the pecan into the chocolate.,3  Refrigerate until the chocolate is relatively firm to the touch. Remove the cups from the refrigerator 10 to 15 minutes before serving.",Mini Butterscotch Phyllo Cups,"1/2,2,6,2,2/3,30,cup,tablespoons,ounces,,cup,,butterscotch baking pieces,milk,cream cheese, at room temperature, cut into pieces,packages (15 per package) prebaked phyllo cups (see Buyers Guide, page 157),semisweet chocolate pieces (about 4-1/2 ounces),pecan halves",http://www.familycircle.com/recipe/desserts/mini-butterscotch-phyllo-cups/,"butterscotch baking pieces,milk,cream cheese at room temperature cut into pieces,packages (15 per package) prebaked phyllo cups (see Buyers Guide page 157),semisweet chocolate pieces (about 4-1/2 ounces),pecan halves",2017-03-23 15:57:27,20 mins,30 mini cups,http://images.familycircle.mdpcdn.com/sites/familycircle.com/themes/meredith/images/recipe-default.png,
"1  Heat oven to 350 degrees F. Coat 15 x 10 x 1-inch jelly-roll pan with nonstick cooking spray. Line with waxed paper; coat paper with spray.,2  Beat together the butter and brown sugar in a large bowl at medium speed until smooth, about 3 minutes. Beat in eggs, one at a time, occasionally scraping down side of bowl with rubber spatula. Beat in molasses.,3  Mix flour, baking soda, cinnamon, cloves, nutmeg and salt in clean bowl.,4  On low speed, beat flour mixture alternately with buttermilk into butter mixture, beginning and ending with the flour mixture. With a rubber spatula, fold in the raisins and nuts. Pour the batter into the prepared jelly-roll pan.,5  Bake in 350 degrees F oven for 15 to 20 minutes or until center is set. Let cool in pan on wire rack. Cut into 2-inch squares.",Betty Shaw's Nutty Hermits,"1/2,1,2,1/2,2,1,1,1/4,1/4,1/4,1/2,1 1/2,1 1/2,cup,cup,,cup,cups,teaspoon,teaspoon,teaspoon,teaspoon,teaspoon,cup,cups,cups,(1 stick) unsalted butter,packed dark-brown sugar,eggs,unsulfured molasses,bleached all-purpose flour,baking soda,ground cinnamon,ground cloves,ground nutmeg,salt,buttermilk,dark seedless raisins,(about 6 ounces) coarsely chopped pecans or walnuts",http://www.familycircle.com/recipe/bars/betty-shaws-nutty-hermits/,"(1 stick) unsalted butter,packed dark-brown sugar,eggs,unsulfured molasses,bleached all-purpose flour,baking soda,ground cinnamon,ground cloves,ground nutmeg,salt,buttermilk,dark seedless raisins,(about 6 ounces) coarsely chopped pecans or walnuts",2017-03-23 15:57:35,20 mins,about 36 bars,http://images.familycircle.mdpcdn.com/sites/familycircle.com/themes/meredith/images/recipe-default.png,  
"1  Prepare Basic White Bread dough.,2  After punching dough down, on lightly floured surface with rolling pin, roll out dough to 12 x 8-inch rectangle. Cut lengthwise into 6 equal strips. Braid 3 strips together to make braided loaf. Place on greased baking sheet. Repeat with remaining strips of dough to make another loaf.,3  Brush each loaf with egg mixture. Cover with plastic wrap; let rise in warm place, away from drafts, until doubled in volume, about 1 hour. Remove plastic wrap. Sprinkle with remaining ingredients.,4  Bake loaves in 400 degrees F oven for 25 to 30 minutes or until golden brown. Loaves will sound hollow when lightly tapped. Transfer breads to wire rack to cool completely. Slice to serve.,5  Stir together 3 cups flour and the salt in a bowl.,6  Sprinkle yeast over 1/4 cup warm water in measuring cup; gently mix to moisten yeast. Let stand for 10 minutes to soften; mixture will be foamy.,7  Pour yeast mixture into flour. Add remaining 1 cup warm water; stir to form ball. If too dry, add a little more water; if too wet, add a little more flour.,8  Turn out onto lightly floured surface. Knead until smooth and elastic, 10 minutes.,9  Grease bowl with butter or margarine. Place dough in bowl; turn to coat. Cover bowl with clean towel or plastic wrap. Let dough rise in warm place until doubled in volume, 1-1/2 to 2 hours. To test, stick finger in dough; dent should remain when finger is removed. Punch dough down.",Everything Braid,"1,1,1,1,1,1,1,recipe,,teaspoon,teaspoon,teaspoon,teaspoon,teaspoon,Basic White Bread (recipe follows),egg mixed with 1 tablespoon water,sesame seeds,poppy seeds,coarse (kosher) salt,dried rosemary,instant toasted onion",http://www.familycircle.com/recipe/breads/everything-braid/,"Basic White Bread (recipe follows),egg mixed with 1 tablespoon water,sesame seeds,poppy seeds,coarse (kosher) salt,dried rosemary,instant toasted onion",2017-03-23 15:57:40,25 mins,2 loaves (8 slices each),http://images.familycircle.mdpcdn.com/sites/familycircle.com/themes/meredith/images/recipe-default.png,  
"1  Heat oven to 350 degrees F. Coat 9-cup fluted tube pan with cooking spray. Mix chips and Grand Marnier in bowl until chips are moistened and shiny. Add 1-1/2 teaspoons flour; toss to coat.,2  Lightly mix eggs, 1/4 cup sour cream and vanilla in another bowl.,3  On low speed, beat in large bowl sifted flour, almonds, sugar, baking powder, baking soda, salt and orange rind for 30 seconds to blend. Add butter and remaining 3/4 cup sour cream; beat on low speed until dry ingredients are moistened. Increase speed to medium; beat 1-1/2 minutes. Scrape down side of bowl. Gradually add egg mixture in 3 batches, beating 20 seconds after each addition. Scrape down side of bowl; stir in chocolate chips. Scrape batter into prepared pan; smooth surface.,4  Bake in 350 degrees F oven 55 to 65 minutes or until cake tester inserted in center comes out clean and top springs back when lightly pressed.,5  Heat sugar, juice and Grand Marnier in small saucepan until sugar is dissolved; do not boil. Remove pan with cake to wire rack. Immediately with cake tester poke holes all over cake; brush on half the syrup. Cool in pan 10 minutes. Unmold onto lightly greased rack. Brush with remaining syrup. Cool.,6  Place chocolate in small bowl. Heat cream in small saucepan to boiling. Pour over chocolate; cover for 5 minutes or until melted. Gently stir together until smooth. Stir in optional Grand Marnier; let cool slightly (about 85 degrees F).,7  Pour glaze over top of cake, letting it dribble down sides. Do not spread to avoid marks in glaze. If glaze is too thick, heat small amount of additional cream and stir in. Let cake stand for 2 hours to set.",Golden Grand Marnier Cake,"1/2,1/4,1 1/2,3,1,1 1/2,2 1/2,2/3,1,1 1/2,1,3/4,2,1,1/2,1/4,1/3,4 1/2,1/2,1 1/2,,cup,teaspoon,teaspoons,,cup,teaspoons,cups,cup,cup,teaspoons,teaspoon,teaspoon,tablespoons,cup,,cup,cup,cup,,ounces,cup,teaspoons,Cake:,mini chocolate chips,Grand Marnier,cake flour,eggs,sour cream,vanilla,sifted cake flour,sliced almonds, finely ground,sugar,baking powder,baking soda,salt,grated orange rind,(2 sticks) unsalted butter, at room temperature,Grand Marnier Syrup:,sugar,fresh orange juice,Grand Marnier liqueur,Chocolate Glaze:,bittersweet chocolate, finely ground,heavy cream,Grand Marnier liqueur (optional)",http://www.familycircle.com/recipe/frosting/golden-grand-marnier-cake/,"Cake:,mini chocolate chips,Grand Marnier,cake flour,eggs,sour cream,vanilla,sifted cake flour,sliced almonds finely ground,sugar,baking powder,baking soda,salt,grated orange rind,(2 sticks) unsalted butter at room temperature,Grand Marnier Syrup:,sugar,fresh orange juice,Grand Marnier liqueur,Chocolate Glaze:,bittersweet chocolate finely ground,heavy cream,Grand Marnier liqueur (optional)",2017-03-23 15:57:44,20 mins,12 servings,http://images.familycircle.mdpcdn.com/sites/familycircle.com/themes/meredith/images/recipe-default.png,  
"1  Have your fish store grind the fillets or grind them yourself in a food processor, using on-and-off pulses, or in a meat grinder. Do not puree.,2  Cook onion in oil in a large skillet over medium-low heat until soft, 6 to 10 minutes.,3  Combine fish, onion, water, eggs, matzoh meal, sugar, parsley, salt and pepper in large bowl of electric mixer. Blend together on low speed, then beat at medium speed for 15 minutes, scraping down sides of bowl frequently.,4  Preheat oven to 325 degrees F. Oil an 8-inch (6-cup) Bundt pan.,5  Spoon fish mixture into prepared pan, smoothing top. Cover tightly with aluminum foil. Set pan in larger pan. Place on oven shelf; add boiling water to larger pan to 1-inch depth.,6  Bake in preheated 325 degrees F oven for 1 hour or until set and knife inserted in center comes out clean. Remove pan to wire rack to cool for 15 minutes. Gently slide a small knife around edge to loosen; invert on serving platter. Cover and refrigerate until ready to serve.,7  Cut into slices and serve with horseradish.",Gefilte Fish Mold,"3/4,3/4,2,1 1/2,1,2,3,1,1,1 1/2,1,pound,pound,,tablespoons,cup,,tablespoons,tablespoon,tablespoon,teaspoons,teaspoon,,whitefish fillets, bones removed and cut in 2-inch chunks,pike fillets, bones removed and cut in 2-inch chunks,medium-size Spanish onions, coarsely chopped (3 cups),kosher-for-Passover vegetable or canola oil,cold water,eggs,matzoh meal,sugar,chopped parsley,salt,ground white pepper,Bottled red horseradish",http://www.familycircle.com/recipe/seafood/gefilte-fish-mold/,"whitefish fillets bones removed and cut in 2-inch chunks,pike fillets bones removed and cut in 2-inch chunks,medium-size Spanish onions coarsely chopped (3 cups),kosher-for-Passover vegetable or canola oil,cold water,eggs,matzoh meal,sugar,chopped parsley,salt,ground white pepper,Bottled red horseradish",2017-03-23 15:58:00,45 mins,20 servings,http://images.familycircle.mdpcdn.com/sites/familycircle.com/themes/meredith/images/recipe-default.png,  
"1  Heat oven to 350 degrees F.,2  Turn flowerpot, bottom up, on counter. Center large-enough piece of extra-wide, heavy-duty aluminum foil over bottom of pot to cover sides of pot, with plenty of overhang. Press foil gently to entire outside of pot to shape foil. Remove foil. Invert pot; place shaped foil inside pot, gently easing foil into pot and covering all surfaces. Gently press foil against sides of pot to flatten all creases. Fold excess foil over top and press firmly to outside of pot, anchoring under flowerpot rim. Coat foil inside pot with nonstick cooking spray.,3  Prepare cake batter following package directions. Remove 1 cup batter to make 3 x 1-1/2-inch cupcakes. (Full amount of batter would overflow pot during baking.) Pour remaining batter into prepared flowerpot. Smooth top with spatula.,4  Bake in 350 degrees F oven 60 to 70 minutes, until wooden pick inserted in center tests clean. If top browns too quickly, cover loosely with foil. Cool in pot on wire rack.,5  When completely cooled, lift foil with cake from pot. Remove foil. Place cake, top up, on serving plate. Trim top flat with serrated knife. Create pot rim: 1-1/2 to 2 inches down from top, with small knife, cut in 1/2 inch, then down to cake bottom at tapered angle. Crumble trimmings; reserve 1/2 cup for dirt.,6  Tint frosting with desired color. Frost cake. Sprinkle top with reserved cake crumbs. Arrange flowers and leaves in pot. (Use any leftover frosting to decorate cupcakes.)",Flowerpot Cake,"1,1,1,1/2,,18 1/4,1,,cup,,unused, clean clay flowerpot (6 inches across inside top, 6 inches deep),devils food cake mix,ready-to-spread vanilla frosting,Assorted food color pastes,cake crumbs, reserved from trimmings,Hyacinths, Daffydils, Leaves and Ladybugs, Tulips (recipes on www.familycircle.com)",http://www.familycircle.com/recipe/chocolate-cakes/flowerpot-cake/,"unused clean clay flowerpot (6 inches across inside top 6 inches deep),devils food cake mix,ready-to-spread vanilla frosting,Assorted food color pastes,cake crumbs reserved from trimmings,Hyacinths Daffydils Leaves and Ladybugs Tulips (recipes on www.familycircle.com)",2017-03-23 15:58:06,1 hr,10 servings,http://images.familycircle.mdpcdn.com/sites/familycircle.com/themes/meredith/images/recipe-default.png,
"1  Cut eggs in half lengthwise and spoon yolks into a bowl. Reserve whites. Mash yolks with a fork. Stir in mayonnaise, honey mustard and black pepper.,2  Reserve 1 tablespoon of the chopped olives. Fold remaining chopped olives into yolk mixture.,3  Fill whites with the yolk mixture. Sprinkle reserved chopped olives over the tops of the eggs. Refrigerate for at least 1 hour.  Serve pieces on a bed of parsley to prevent egg halves from rolling around on the platter.",Savory Deviled Eggs,"12,1/2,1,1/4,8,,cup,tablespoon,teaspoon,large,,hard-cooked eggs, peeled,light mayonnaise,honey mustard,black pepper,pimiento-stuffed olives, chopped,Parsley for garnish",http://www.familycircle.com/recipe/eggs-cheese/savory-deviled-eggs/,"hard-cooked eggs peeled,light mayonnaise,honey mustard,black pepper,pimiento-stuffed olives chopped,Parsley for garnish",2017-03-23 15:58:11,20 mins,24 pieces,http://images.familycircle.mdpcdn.com/sites/familycircle.com/themes/meredith/images/recipe-default.png,
"1  Heat oven to 350 degrees F. Coat a 10-inch spring form pan with nonstick cooking spray. Wrap outside of pan with foil. In a large bowl, beat cream cheese until smooth. Add sugar, then cornstarch, butter, cream and eggs, beating well after each addition. Pour into prepared pan. Place in a pan filled with 1 inch of water.,2  Bake at 350 degrees F for 1 hour or until golden brown. Transfer to a wire rack to cool.,3  Once cheesecake has cooled (about 3 hours) remove side of pan, cover and put in refrigerator.",Family Cheesecake,"4,1 1/2,1/2,1,2,6,packages,cups,cup,cup,cups,,(8 ounces each) cream cheese, softened,sugar,cornstarch,(2 sticks) unsalted butter, softened,heavy cream,eggs",http://www.familycircle.com/recipe/desserts/family-cheesecake/,"(8 ounces each) cream cheese softened,sugar,cornstarch,(2 sticks) unsalted butter softened,heavy cream,eggs",2017-03-23 15:58:18,10 mins,16 servings,http://images.familycircle.mdpcdn.com/sites/familycircle.com/themes/meredith/images/recipe-default.png,
"1  Heat oven to 350 degrees F. Coat 4-quart casserole with cooking spray.,2  Combine beans, ground round, sugar, salt, cinnamon, allspice, pepper and ground cloves in a bowl.,3  Layer one-third of sweet potato slices in casserole. Spread half of bean mixture over top. Sprinkle with third of cheese. Repeat layering again. Place remaining third of sweet potato slices on top. Cover with foil.,4  Bake in 350 degrees F oven for 1 hour. Sprinkle remaining cheese over top. Bake, uncovered, another 30 minutes or until potatoes are tender. Let stand 10 minutes before serving.",Sweet Potato And Bean Casserole,"1,1,1,1,2,1,1,1/2,1/3,1/4,4,2,19,19,19,pound,teaspoons,teaspoon,teaspoon,teaspoon,teaspoon,teaspoon,,cups,chickpeas, drained and rinsed,white beans, drained and rinsed,red kidney beans, drained and rinsed,ground round steak,sugar,salt,ground cinnamon,ground allspice,black pepper,ground cloves,sweet potatoes (about 2 pounds), peeled and cut into 1/8-inch-thick slices,shredded Cheddar cheese",http://www.familycircle.com/recipe/vegetables/sweet-potato-and-bean-casserole/,"chickpeas drained and rinsed,white beans drained and rinsed,red kidney beans drained and rinsed,ground round steak,sugar,salt,ground cinnamon,ground allspice,black pepper,ground cloves,sweet potatoes (about 2 pounds) peeled and cut into 1/8-inch-thick slices,shredded Cheddar cheese",2017-03-23 15:58:25,15 mins,10 servings,http://images.familycircle.mdpcdn.com/sites/familycircle.com/themes/meredith/images/recipe-default.png,  
"1  Chill metal bowl and beaters to make whipped cream. Finely grind chocolate in food processor.,2  Heat cream in saucepan just until small bubbles appear around edge of pan. With motor running, pour cream in stream through feed tube of food processor and process until chocolate mixture is smooth.,3  Transfer to bowl. Stir in Chambord if using. Cool 15 minutes or until room temperature, but still fluid. Pour into prepared crust. Top with raspberries; chill 2 hours.,4  Start by mixing chocolate and almonds in small bowl.,5  Sprinkle gelatin over water in heatproof glass measuring cup; let stand until softened, for about 5 minutes. Set cup in pan of simmering water; stir occasionally until gelatin is dissolved. Remove cup from water; let cool to room temperature, 5 to 7 minutes. Gelatin must be liquid, but not warm, when added to cream.,6  Beat cream and sugar in chilled bowl with chilled beaters just until traces of beater marks begin to show distinctly. Add gelatin mixture in steady stream, beating constantly. Add vanilla; beat just until soft peaks form. Fold in chocolate-nut mixture. Chill until set, about 4 hours.,7  Place dollops of cream mixture over top of raspberries; smooth with spatula to cover top. Refrigerate.,8  Heat oven to 200 degrees F. Line baking sheet with foil. Beat whites in large bowl until foamy. Add cream of tartar; beat on medium speed, gradually adding superfine sugar, tablespoon at a time, until soft peaks form. Beat on high speed until peaks are very stiff and glossy.,9  Whisk cocoa and 1/2 cup sugar in bowl. Sift over beaten whites; fold in. Spoon into pastry bag fitted with large round tip. Pipe 4 lines of meringue along length of sheet, 1-1/2 inches apart.,10  Bake in 200 degrees F oven 1-1/2 hours or until dry. Let cool completely. Break into 3/4-inch pieces. Heap boulders onto pie. Place cocoa in fine-mesh strainer; dust top of pie. Serve.",Grand Canyon Pie,"4,1/2,2,1,1,3,1/4,1,1 1/2,1,2,1/2,2,1/4,1/4,1,1/2,1,ounces,cup,teaspoons,,cup,ounces,cup,teaspoon,tablespoons,cup,tablespoons,teaspoon,,teaspoon,teaspoon,tablespoon,cup,teaspoon,bittersweet chocolate, broken into pieces,heavy cream,Chambord (black raspberry liqueur) (optional),premade 9-inch chocolate wafer pie shell (6 ounces),fresh raspberries,bittersweet chocolate, finely grated (1/2 cup),finely ground blanched almonds,unflavored gelatin,water,heavy cream,confectioners sugar,vanilla,egg whites,cream of tartar,superfine sugar,unsweetened cocoa powder,confectioners sugar,unsweetened cocoa powder, for dusting",http://www.familycircle.com/recipe/pies/grand-canyon-pie/,"bittersweet chocolate broken into pieces,heavy cream,Chambord (black raspberry liqueur) (optional),premade 9-inch chocolate wafer pie shell (6 ounces),fresh raspberries,bittersweet chocolate finely grated (1/2 cup),finely ground blanched almonds,unflavored gelatin,water,heavy cream,confectioners sugar,vanilla,egg whites,cream of tartar,superfine sugar,unsweetened cocoa powder,confectioners sugar,unsweetened cocoa powder for dusting",2017-03-23 15:58:30,25 mins,12 servings,http://images.familycircle.mdpcdn.com/sites/familycircle.com/themes/meredith/images/recipe-default.png,  
1  Pull meat from rib bones and place in large bowl. Add peas and salsa; stir to combine. Cover; let stand 30 minutes or up to 24 hours in refrigerator before serving. Serve at room temperature.,Smoky Black-Eyed Peas,"1 1/2,2,2,pounds,15,cups,cooked barbecued pork ribs,black-eyed peas, drained,chunky-style salsa",http://www.familycircle.com/recipe/vegetables/smoky-black-eyed-peas/,"cooked barbecued pork ribs,black-eyed peas drained,chunky-style salsa",2017-03-23 15:58:37,5 mins,8 servings,http://images.familycircle.mdpcdn.com/sites/familycircle.com/themes/meredith/images/recipe-default.png,
